{
  "schema_version": 1,
  "round": "2026-09-11-check-docs-02",
  "lane": "src",
  "candidates_found": 6,
  "checked": [
    "src/GBGCodingTools.jl",
    "src/Scan.jl",
    "src/Reflection.jl",
    "src/TestHarness.jl",
    "src/HtmlWalker.jl",
    "src/DocLints.jl",
    "src/Witnesses.jl",
    "src/TreeHash.jl",
    "src/CLI/Main.jl",
    "src/CLI/Config.jl",
    "src/CLI/Schema.jl",
    "src/CLI/Ledger.jl",
    "src/CLI/Doctor.jl",
    "src/CLI/Gate.jl",
    "src/CLI/Consolidate.jl",
    "src/CLI/Audit.jl",
    "src/CLI/Bump.jl",
    "src/CLI/Demote.jl",
    "src/CLI/Design.jl",
    "src/CLI/Fleet.jl",
    "src/CLI/Git.jl",
    "src/CLI/Hunt.jl",
    "src/CLI/Init.jl",
    "src/CLI/Install.jl",
    "src/CLI/Passes.jl",
    "src/CLI/Preflight.jl",
    "src/CLI/Recall.jl",
    "src/CLI/Release.jl",
    "src/CLI/RoundFiles.jl",
    "src/CLI/Rounds.jl",
    "src/CLI/Seed.jl",
    "src/CLI/Self.jl",
    "src/CLI/Selftest.jl",
    "src/CLI/Sync.jl",
    "src/Scans/abutting_spans.jl",
    "src/Scans/ai_banner.jl",
    "src/Scans/api_page_structure.jl",
    "src/Scans/arg_bullet_bold.jl",
    "src/Scans/argcov.jl",
    "src/Scans/args_form.jl",
    "src/Scans/boldsymbol_unbraced.jl",
    "src/Scans/citation_crammed.jl",
    "src/Scans/code_in_math.jl",
    "src/Scans/dead_ref.jl",
    "src/Scans/doi_crosscheck.jl",
    "src/Scans/dupref.jl",
    "src/Scans/field_docs.jl",
    "src/Scans/formula_in_backticks.jl",
    "src/Scans/frac_unbraced.jl",
    "src/Scans/html_base_leak.jl",
    "src/Scans/html_docstring_once.jl",
    "src/Scans/html_public_home.jl",
    "src/Scans/html_rendered_markup.jl",
    "src/Scans/html_stray_math.jl",
    "src/Scans/inline_math_split.jl",
    "src/Scans/leftright.jl",
    "src/Scans/link_uniformity.jl",
    "src/Scans/manual_spacing.jl",
    "src/Scans/mathbb_digit.jl",
    "src/Scans/mathbf.jl",
    "src/Scans/neg_thin_bigl.jl",
    "src/Scans/neg_thin_double.jl",
    "src/Scans/partial_bare.jl",
    "src/Scans/prose_shape.jl",
    "src/Scans/ref_abut_code.jl",
    "src/Scans/register.jl",
    "src/Scans/retired_claims.jl",
    "src/Scans/sentence_opener.jl",
    "src/Scans/sibling_link.jl",
    "src/Scans/signature_fidelity.jl",
    "src/Scans/signature_wide.jl",
    "src/Scans/stray_tex_dollar.jl",
    "src/Scans/swallowed_escape.jl",
    "src/Scans/table_indented.jl",
    "src/Scans/thin_space.jl",
    "src/Scans/xlink.jl"
  ],
  "findings": [
    {
      "type": "self-containment",
      "severity": "major",
      "confidence": "high",
      "title": "Docstrings across src cite ARCHITECTURE.md section numbers, which RULE.DOC.NO_DEAD_REFS forbids",
      "locations": [
        "src/CLI/Sync.jl:467 — \"in that order (ARCHITECTURE §6.1); the stamp every round records\"",
        "src/CLI/Demote.jl:19 — \"and that contradiction shipped. §12 records the fork, content against emptiness\"",
        "src/CLI/Selftest.jl:8 — \"so the arms of §8 run over the fixture wherever the tool is installed\"",
        "src/CLI/Gate.jl:8 — \"The closure gate (§6.2 step 10). The arguments are:\"",
        "src/CLI/RoundFiles.jl:66 — \"recorded after bank (ARCHITECTURE §6.3), so recording one leaves the hash\"",
        "src/CLI/Init.jl:92 — \"The best config the package tree supports (ARCHITECTURE §5): name and description from\"",
        "src/CLI/Preflight.jl:59 — \"The config stamp of §6.1 — [`Sync.config_sha`](@ref), the one definition.\"",
        "src/CLI/Doctor.jl:8 — \"The read-only health check of a consumer's tooling (D14, §7.3).\"",
        "src/CLI/Passes.jl:201 — \"and a row of the §12.B catalogue table. The verifier\"",
        "src/CLI/Passes.jl:1055 — \"The conditions (§6.2 step 9; §6.7 for the hunt; §6.8 for the audit):\""
      ],
      "description": "RULE.DOC.NO_DEAD_REFS states verbatim: \"A rendered docstring or a thrown error message cites no section number, repo path or inaccessible source, and reads complete at the REPL where links are dead. ... Section citations and design rationale stay in `#` comments and the rationale documents.\" This is enforced by SCAN.DEAD_REF's `§\\s?[0-9]` pattern, applied only to text `prose_lines` extracts as docstring content (a triple-quoted string whose opening `\"\"\"` sits alone on its line — the house form both `Reflection.docstrings` and the scan engine key on, which is why a header comment or a `const X = \"\"\"...\"\"\"` data string is correctly exempt). At least 10 real, rendered docstrings across the src surface embed an ARCHITECTURE.md section number (§6.1, §6.2, §6.3, §5, §7.3, §8, §12, §12.B) directly in their prose — not in a `#` comment above the function, where the rule says such a citation belongs (and where the identical fact is often already stated, in the very same file's top-of-file comment). A reader at the REPL (`?GBGCodingTools.gate`, `?TestHarness.selftest`, `?Doctor`, etc.) or on the built API page sees a bare section number with no way to resolve it — exactly the failure this rule exists to prevent. This is a class, not one instance.",
      "resolution_hint": "For each listed docstring, drop the `§N[.M]` reference from the rendered text (state the invariant itself, as the surrounding sentence already does) and, if the citation is still wanted for a maintainer, move it to the `#` comment immediately above the function/module, mirroring the file's own top-of-file `# ... (ARCHITECTURE §N)` comment."
    },
    {
      "type": "self-containment",
      "severity": "minor",
      "confidence": "high",
      "title": "`resolve_function` docstring cites a nonexistent `Scan.report` qualified name",
      "locations": [
        "src/TestHarness.jl:301-302 — \"so `Config.read`, `Git.run` and `Scan.report` denote the package's function and not the `Base` export they collide with\""
      ],
      "description": "The docstring of `TestHarness.resolve_function` offers `Config.read`, `Git.run` and `Scan.report` as worked examples of a package module owning a name that also collides with a `Base` export. `Config.read` and `Git.run` are genuine (module `Config` in src/CLI/Config.jl owns `read`, extending `Base.read`; module `Git` in src/CLI/Git.jl owns `run`, extending `Base.run`), but no module named `Scan` exists anywhere in the codebase (`grep -rn 'module Scan\\b' src/` returns nothing): `report` is a plain function defined directly inside `module GBGCodingTools` by src/Scan.jl (`function report(results::AbstractVector{ScanResult}; io::IO = stdout)`, line 455), included without its own `module Scan ... end` wrapper. Its real qualified name is `GBGCodingTools.report`, never `Scan.report`. The example also fails on its own terms even corrected: `Base` exports no `report` for `GBGCodingTools.report` to collide with, unlike `read`/`run`, so it demonstrates nothing about the ownership-vs-Base-collision point the sentence makes.",
      "resolution_hint": "Replace `Scan.report` with a real third example of a package-owned name shadowing a Base export (or drop it, keeping `Config.read`/`Git.run`), and re-check any other inline prose example in this docstring resolves to an actual qualified name."
    }
  ]
}
