{
  "schema_version": 1,
  "round": "2026-09-10-check-docs-03",
  "lane": "pages",
  "candidates_found": 5,
  "checked": [
    "docs/src/api/CLI.md",
    "docs/src/api/Config.md",
    "docs/src/api/Reflection.md",
    "docs/src/api/TestHarness.md",
    "docs/src/api/Witnesses.md",
    "docs/src/guide/config.md",
    "docs/src/guide/install.md",
    "docs/src/guide/ledger.md",
    "docs/src/guide/rounds.md",
    "docs/src/guide/verbs.md",
    "docs/src/index.md",
    "cross-checked against src/CLI/Doctor.jl (CHECKS/check! count)",
    "cross-checked against src/CLI/Main.jl (VERBS registrations, 21 total)",
    "cross-checked against src/Scans/*.jl (42 register_scan! calls)",
    "cross-checked against .gbg/scratch/.../policy.md (95 RULE.* headers)",
    "cross-checked against src/TestHarness.jl (oracle_registry docstring, oracle classes)",
    "cross-checked against src/CLI/Demote.jl (demote() condition)",
    "cross-checked against src/CLI/Ledger.jl, src/CLI/Config.jl, src/CLI/Install.jl, src/CLI/Rounds.jl, src/CLI/Passes.jl, src/CLI/Preflight.jl, src/CLI/Gate.jl, ext/GBGCodingToolsDocumenterExt.jl for guide-page prose",
    "every @docs binding across all five API pages resolved against src/ and ext/ (all found, none dangling)"
  ],
  "findings": [
    {
      "type": "currency",
      "severity": "major",
      "confidence": "high",
      "title": "index.md's doctor check count is stale (\"47\" vs the actual 49)",
      "locations": [
        "docs/src/index.md:49 — \"47 read-only checks that a package is wired correctly\"",
        "src/CLI/Doctor.jl:96-680 — 49 `check!(\"ID\", ...)` registrations (50 `check!(` lines minus the helper definition at line 96)"
      ],
      "description": "index.md claims `gbg doctor` runs \"47 read-only checks\", but counting every `check!(\"...\", ...)` registration in src/CLI/Doctor.jl gives 49 distinct check ids (verified by grepping unique ids). Neither the default run (49 minus the 6-entry DEEP list = 43) nor the `--deep` run (49) equals 47, so the figure is stale under RULE.DOC.CURRENT regardless of which mode is meant.",
      "resolution_hint": "Update index.md to state the current count (49 total, or specify \"43 by default, 49 with --deep\"), and re-measure this number whenever a check is added or removed (RULE.TEST.COUNTS_REMEASURED)."
    },
    {
      "type": "math",
      "severity": "major",
      "confidence": "high",
      "title": "index.md mischaracterizes TestHarness's oracle engine as requiring \"an independent reference\" for every operation",
      "locations": [
        "docs/src/index.md:61-62 — \"an independent reference for every public value-returning operation\"",
        "src/TestHarness.jl:398-401 — \"every class is one of `analytic | independent | property | relational | structural`; no operation rests on `relational` alone\""
      ],
      "description": "`TestHarness.oracle_registry` requires every public value-returning operation to be CLASSIFIED into one of five oracle classes, and only bars `relational`-only coverage; it does not require an independent reference for every operation. A `structural` operation (returns metadata/storage) needs no citation at all (`class == \"structural\" && continue` before the citation checks), and a `property` oracle is an invariant, not a reference value. The page's plausible-sounding paraphrase overstates the guarantee — exactly the false-but-plausible pattern RULE.DOC.VERIFIED warns against.",
      "resolution_hint": "Reword to match RULE.TEST.ORACLE_INDEPENDENT's own framing: \"every public value-returning operation classified by oracle provenance (analytic, independent, property, relational or structural), with relational never standing alone\"."
    },
    {
      "type": "currency",
      "severity": "minor",
      "confidence": "high",
      "title": "rounds.md's demotion rule names only half of the actual trigger condition",
      "locations": [
        "docs/src/guide/rounds.md:42 — \"The demotion is mechanical: `HONORED` with an empty `class_surfaces[]` becomes `LINE-ONLY`.\"",
        "src/CLI/Demote.jl:22-23 — `if get(verdict, \"verdict\", \"\") == \"HONORED\" && (isempty(cs) || any(c -> !get(c, \"swept\", false), cs))`"
      ],
      "description": "`demote()` also demotes a HONORED verdict when `class_surfaces` is non-empty but any entry has `swept == false` — a claimed-but-unswept class sweep. rounds.md's sentence names only the empty-array case, which is a true-but-partial statement of the rule (RULE.DOC.CURRENT: naming only a subset of what the code does is stale even if literally true).",
      "resolution_hint": "State both arms: \"`HONORED` becomes `LINE-ONLY` when `class_surfaces[]` is empty or any of its entries is not marked `swept`.\""
    }
  ]
}
