{
  "schema_version": 1,
  "round": "2026-09-11-check-docs-02",
  "lane": "catalogues",
  "candidates_found": 2,
  "checked": [
    "catalog/scans.toml (42 [[scan]] rows: rule, tier, surfaces, fixture)",
    "catalog/models.toml",
    "catalog/seeds/fixture.toml (8 seed classes)",
    "catalog/lanes/check-docs.toml (surface brief + 3 cross lanes)",
    "catalog/lanes/audit-changes.toml (13 lanes)",
    "catalog/lanes/bug-hunt.toml (2 free lanes)",
    "catalog/lanes/README.md",
    "catalog/hats/*.toml (22 generic hat files) + catalog/hats/README.md",
    "catalog/attack/check-docs.toml",
    "catalog/attack/audit-changes.toml",
    "catalog/attack/bug-hunt.toml",
    "catalog/attack/check-consistency.toml",
    "policy/RULES.toml (95 rule rows, cross-referenced bidirectionally against scans.toml's rule/check fields)",
    "fixture/GBG Fixture/defects.toml (48 [[defect]] + 26 [[clean]] rows, cross-referenced bidirectionally against scans.toml's fixture arrays)",
    "fixture/GBG Fixture corpus files (grepped to confirm the 8 seed-class anchors in catalog/seeds/fixture.toml actually occur in the rendered fixture text, excluding fixture/.tmp/ and defects/)",
    "src/CLI/Config.jl, src/GBGCodingTools.jl, schema/config.schema.json (real surface-key vocabulary: rationale, pages, src, ext, literate, data, built_html, plus compounds docs/all)",
    "docs/ARCHITECTURE.md D18 / docs/design-record/*.md (intended anchor=true set: the 5 named audit lanes, the 2 free hunt lanes, and that generic check-consistency hats default anchor=false)"
  ],
  "findings": []
}
