{
  "schema_version": 1,
  "round": "2026-09-10-check-docs-03",
  "lane": "ext",
  "candidates_found": 10,
  "checked": [
    "/tmp/jl_2wCsL7/ext/GBGCodingToolsDocumenterExt.jl (full file, 50 lines)",
    "/tmp/jl_2wCsL7/src/DocLints.jl (the `makedocs` home docstring, cross-checked for consistency)",
    "/tmp/jl_2wCsL7/src/CLI/Doctor.jl (GBG_DOCS_NO_SKIP usage, makedocs banner regex, doctor() signature/return)",
    "/tmp/jl_2wCsL7/src/CLI/Release.jl (GBG_DOCS_NO_SKIP usage)",
    "/tmp/jl_2wCsL7/src/CLI/Gate.jl (gate()/frozen_rounds() signatures, GBG_DOCS_NO_SKIP mention)",
    "/tmp/jl_2wCsL7/src/Scan.jl (scan_docs()/scan_html()/write_public_surface() signatures and return contracts)",
    "/tmp/jl_2wCsL7/src/CLI/Main.jl (tool_version() definition)",
    "/tmp/jl_2wCsL7/src/GBGCodingTools.jl, src/HtmlWalker.jl, src/CLI/Consolidate.jl, src/CLI/Init.jl, src/Scans/*.jl (grep for stray using/import Documenter outside ext, and for other definitions of makedocs)",
    "/tmp/jl_2wCsL7/templates/make.jl.seed (consumer-side using Documenter, GBGCodingTools claim)"
  ],
  "findings": [
    {
      "type": "style",
      "severity": "minor",
      "confidence": "high",
      "title": "check() docstring signature omits the method's explicit argument types",
      "locations": [
        "ext/GBGCodingToolsDocumenterExt.jl:14: `    check(verb, code)`",
        "ext/GBGCodingToolsDocumenterExt.jl:19: `check(verb::AbstractString, code::Integer) = code == 0 ? nothing : error(...)`"
      ],
      "description": "RULE.DOC.SIGNATURE_MIRROR requires that 'an argument typed in the method is typed in the docstring.' The method defines verb::AbstractString and code::Integer, but the docstring's displayed signature line 14 shows the bare, untyped check(verb, code), so the docstring signature diverges from the actual method table on exactly the types the rule says must mirror.",
      "resolution_hint": "Change the docstring's signature line to `check(verb::AbstractString, code::Integer)` so it mirrors the method's real type annotations."
    }
  ]
}
