{
  "schema_version": 1,
  "round": "2026-09-11-check-docs-02",
  "lane": "schemas",
  "candidates_found": 0,
  "checked": [
    "schema/architecture-fix.schema.json vs src/CLI/Passes.jl (verify-architecture path)",
    "schema/attack.schema.json vs instruments/audit-changes/workflow/attack-design.js and src/CLI/Design.jl attack_read",
    "schema/attack-subject.schema.json vs catalog/attack/*.toml and src/CLI/Design.jl attack",
    "schema/audit.schema.json vs src/CLI/Audit.jl",
    "schema/carried.schema.json vs src/CLI/Passes.jl and .gbg/carried.toml (live data)",
    "schema/config.schema.json vs src/CLI/Config.jl, src/CLI/Init.jl",
    "schema/dismissal.schema.json vs instruments/bug-hunt/workflow/dismissals.js and src/CLI/Passes.jl (dismissal_items/assemble_dismissals)",
    "schema/exemptions.schema.json vs src/CLI/Ledger.jl and .gbg/exemptions.toml (live data)",
    "schema/finding.schema.json vs src/CLI/Rounds.jl bank (core-projection use)",
    "schema/ground-truth.schema.json vs src/CLI/Rounds.jl bank (seeded path)",
    "schema/hat.schema.json vs src/CLI/Doctor.jl CFG.HATS",
    "schema/human-findings.schema.json vs src/CLI/Design.jl calibrate",
    "schema/import.schema.json vs src/CLI/Rounds.jl (round import)",
    "schema/managed.schema.json vs src/CLI/Sync.jl",
    "schema/pass.schema.json vs src/CLI/Passes.jl (pass.toml writers)",
    "schema/reproduction.schema.json vs src/CLI/Rounds.jl (bug-hunt bank/reproductions)",
    "schema/round.schema.json vs src/CLI/Preflight.jl (round open) and src/CLI/Rounds.jl (save/guard)",
    "schema/rubric-audit.schema.json vs instruments/check-consistency/workflow/rubric-audit.js (referenced) and src/CLI/Design.jl calibrate_read",
    "schema/severity.schema.json vs src/CLI/Passes.jl (severity-recheck path)",
    "schema/tally.schema.json vs src/CLI/Passes.jl (round grade)",
    "schema/verdict-act.schema.json vs src/CLI/Passes.jl read_verdicts(..., \"verdict-act\")",
    "schema/verdict-state.schema.json vs src/CLI/Passes.jl read_verdicts(..., \"verdict-state\")",
    "instruments/check-docs/schema.json vs src/CLI/Preflight.jl render_args (args) and src/CLI/Rounds.jl classify_lane (lane_file)",
    "instruments/check-consistency/schema.json vs same, plus its $defs/seeds vs src/CLI/Seed.jl and src/CLI/Doctor.jl CFG.SEEDS",
    "instruments/bug-hunt/schema.json vs same, plus instruments/bug-hunt/workflow (hunt_finding shape)",
    "instruments/audit-changes/schema.json vs same, plus the allOf-extended finding shape (before/after/why_it_matters/justified/evidence required)",
    "src/CLI/Schema.jl (the validator itself): the documented keyword subset in its header comment vs every keyword actually used across all 25 files",
    "every $ref in all 25 files for locality (all are #/$defs/... or #/properties/...)",
    "grep of load_schema(...) / instrument_schema(...) call sites across src/ and ext/ to confirm no schema file is dead"
  ],
  "findings": []
}
