{
  "schema_version": 1,
  "round": "2026-09-11-check-docs-01",
  "lane": "src",
  "candidates_found": 8,
  "checked": [
    "src/CLI/Audit.jl",
    "src/CLI/Bump.jl",
    "src/CLI/Config.jl",
    "src/CLI/Consolidate.jl",
    "src/CLI/Demote.jl",
    "src/CLI/Doctor.jl",
    "src/CLI/Fleet.jl",
    "src/CLI/Gate.jl",
    "src/CLI/Git.jl",
    "src/CLI/Hunt.jl",
    "src/CLI/Init.jl",
    "src/CLI/Install.jl",
    "src/CLI/Ledger.jl",
    "src/CLI/Main.jl",
    "src/CLI/Passes.jl",
    "src/CLI/Preflight.jl",
    "src/CLI/Recall.jl",
    "src/CLI/Release.jl",
    "src/CLI/RoundFiles.jl",
    "src/CLI/Rounds.jl",
    "src/CLI/Schema.jl",
    "src/CLI/Seed.jl",
    "src/CLI/Self.jl",
    "src/CLI/Selftest.jl",
    "src/CLI/Sync.jl",
    "src/DocLints.jl",
    "src/GBGCodingTools.jl",
    "src/HtmlWalker.jl",
    "src/Reflection.jl",
    "src/Scan.jl",
    "src/Scans/abutting_spans.jl",
    "src/Scans/ai_banner.jl",
    "src/Scans/api_page_structure.jl",
    "src/Scans/arg_bullet_bold.jl",
    "src/Scans/argcov.jl",
    "src/Scans/args_form.jl",
    "src/Scans/boldsymbol_unbraced.jl",
    "src/Scans/citation_crammed.jl",
    "src/Scans/code_in_math.jl",
    "src/Scans/dead_ref.jl",
    "src/Scans/doi_crosscheck.jl",
    "src/Scans/dupref.jl",
    "src/Scans/field_docs.jl",
    "src/Scans/formula_in_backticks.jl",
    "src/Scans/frac_unbraced.jl",
    "src/Scans/html_base_leak.jl",
    "src/Scans/html_docstring_once.jl",
    "src/Scans/html_public_home.jl",
    "src/Scans/html_rendered_markup.jl",
    "src/Scans/html_stray_math.jl",
    "src/Scans/inline_math_split.jl",
    "src/Scans/leftright.jl",
    "src/Scans/link_uniformity.jl",
    "src/Scans/manual_spacing.jl",
    "src/Scans/mathbb_digit.jl",
    "src/Scans/mathbf.jl",
    "src/Scans/neg_thin_bigl.jl",
    "src/Scans/neg_thin_double.jl",
    "src/Scans/partial_bare.jl",
    "src/Scans/prose_shape.jl",
    "src/Scans/ref_abut_code.jl",
    "src/Scans/register.jl",
    "src/Scans/retired_claims.jl",
    "src/Scans/sentence_opener.jl",
    "src/Scans/sibling_link.jl",
    "src/Scans/signature_fidelity.jl",
    "src/Scans/signature_wide.jl",
    "src/Scans/stray_tex_dollar.jl",
    "src/Scans/swallowed_escape.jl",
    "src/Scans/table_indented.jl",
    "src/Scans/thin_space.jl",
    "src/Scans/xlink.jl",
    "src/TestHarness.jl",
    "src/TreeHash.jl",
    "src/Witnesses.jl",
    "ext/GBGCodingToolsDocumenterExt.jl (consulted as ground truth for DocLints.jl's makedocs docstring)",
    "cross-check: reimplemented Reflection.argcov's signature/docstring-arg-coverage sweep over every docstring of the src surface (0 hits — clean)",
    "cross-check: enumerated every [`x`](@ref) target under src/ against defined bindings (no orphan-looking targets found)"
  ],
  "findings": [
    {
      "type": "currency",
      "severity": "major",
      "confidence": "high",
      "title": "The package's own top-level module docstring is not a map of the module any more",
      "locations": [
        "src/GBGCodingTools.jl:26-45: \"The module is a map; every part is documented at its home. The command line and its configuration: … The engines: …\""
      ],
      "description": "GBGCodingTools's module docstring explicitly bills itself as the map of the whole package (\"The module is a map; every part is documented at its home\", RULE.DOC.MODULE_MAP) and then names exactly nine things: main, Config, makedocs, TestHarness, Reflection, Witnesses, the scan-engine trio, TreeHash, HtmlWalker and consolidate. The module's own include list (lines 55-86) names 29 files, and the map gives no linked one-liner — not even a bare mention — for Sync (the managed-file renderer), Doctor, Ledger, RoundFiles, Git, Schema, Seed, Recall, Preflight, Rounds, Passes (the whole round-lifecycle: open, bank, grade, close — arguably the tool's central mechanism), Init, Demote, Hunt, Audit, Fleet, Bump, Release or Selftest. A cold reader of the map has no way to learn any of this machinery exists. RULE.DOC.CURRENT: \"a summary that names only a subset of what the code now provides is stale even if literally true.\"",
      "resolution_hint": "Add at least a linked one-liner per operation family the omitted files own (e.g. Preflight/Rounds/Passes — the round lifecycle; Sync — the managed-file renderer; Doctor — the health check; Ledger — the exemption reader) to the map, the way the engines section already covers TestHarness/Reflection/Witnesses."
    },
    {
      "type": "operational",
      "severity": "minor",
      "confidence": "high",
      "title": "apply_ledger's docstring overstates when a wildcard ledger entry disables a scan",
      "locations": [
        "src/Scan.jl:344-345: \"with target `*` disables the scan (every hit exempted, `disabled = true`)\"",
        "src/Scan.jl:356: `any(e -> e[\"target\"] == \"*\" && !haskey(e, \"match\"), scan_entries) && return (Hit[], length(hits), true)`"
      ],
      "description": "The docstring says a scope = \"scan\" entry with target = \"*\" always disables the scan. The code only disables it when that entry ALSO carries no match table (!haskey(e, \"match\")); a target = \"*\" entry that does carry a match table falls through to the per-hit loop below and is applied like any other exemption (only hits whose file/symbol/arg satisfy the match are exempted, the rest are kept). match alongside target = \"*\" is a legal combination under schema/exemptions.schema.json (nothing forbids it), so this is a reachable, not merely theoretical, case the docstring gets wrong. (The scope = \"policy\" disable check just above it, lines 351-352, has no such match guard and is described correctly.)",
      "resolution_hint": "Qualify the scan-scope clause: \"…with target `*` and no `match` table disables the scan…\", distinguishing it from a wildcard entry that does carry match, which is instead evaluated per hit."
    },
    {
      "type": "currency",
      "severity": "nit",
      "confidence": "high",
      "title": "TestHarness's module map omits its own exported counting helper",
      "locations": [
        "src/TestHarness.jl:10-18: the module docstring's \"the element-traffic audit ([`TestHarness.CountingArray`](@ref), [`TestHarness.Traffic`](@ref), [`TestHarness.audit`](@ref))\"",
        "src/TestHarness.jl:26: `export @alloc_below, CountingArray, Traffic, counting, audit, run_regressions, gate`"
      ],
      "description": "counting is one of only seven names TestHarness exports, and it has its own docstring (line 133), but the module docstring's map of the element-traffic audit lists CountingArray, Traffic and audit and never mentions counting — the constructor a user actually calls to wrap an array before auditing it.",
      "resolution_hint": "Add [`TestHarness.counting`](@ref) to the element-traffic-audit bullet, e.g. \"([`TestHarness.counting`](@ref), [`TestHarness.CountingArray`](@ref), [`TestHarness.Traffic`](@ref), [`TestHarness.audit`](@ref))\"."
    }
  ]
}
